{
  "schema": "agent_run_v1",
  "run_id": "v031-operator",
  "issue_ref": null,
  "pr_ref": null,
  "role": "coder",
  "agent_id": "codex",
  "prompt_version": "coding-agent-1.1",
  "started_at_utc": "2026-09-24T07:45:00Z",
  "finished_at_utc": "2026-09-24T08:08:09.164905Z",
  "input_refs": [
    "Dockerfile",
    "app/operator_tui/__main__.py",
    "app/operator_tui/app.py",
    "app/operator_tui/presenter.py",
    "app/pomidorctl/cli.py",
    "app/pomidorctl/config.py",
    "tests/test_docker_e2e.py",
    "tests/test_operator_tui.py",
    "tests/test_pomidorctl.py",
    "tests/test_release_assets.py"
  ],
  "output_refs": [
    "docs/implementation-reports/V031-operator-report.md"
  ],
  "status": "completed",
  "commands": [
    {
      "command": "python -m pytest -q"
    },
    {
      "command": "nox -s lint format_check types"
    }
  ],
  "validation_results": [
    {
      "check": "software_tests",
      "status": "PASS",
      "result": "685 passed; two opt-in tests skipped"
    },
    {
      "check": "compose_config",
      "status": "NOT_RUN",
      "result": "Docker executable unavailable locally"
    },
    {
      "check": "quality",
      "status": "PASS"
    }
  ],
  "human_edits": [],
  "findings": [
    {
      "category": "packaging",
      "outcome": "confirmed"
    },
    {
      "category": "operator_refresh",
      "outcome": "confirmed"
    }
  ],
  "errors": [],
  "usage": {
    "file_count": 10,
    "input_characters": 88501,
    "tool_output_bytes": 0,
    "elapsed_seconds": 0
  }
}
