{
  "schema": "agent_run_v1",
  "run_id": "20260824-issue-227-coder",
  "issue_ref": "ISSUE-227",
  "pr_ref": null,
  "role": "coder",
  "agent_id": "codex-local",
  "prompt_version": "human-approved-implementation-plan-v1",
  "started_at_utc": "2026-08-24T14:35:00Z",
  "finished_at_utc": "2026-08-24T15:07:00Z",
  "input_refs": [
    "AGENTS.md",
    ".ai/CORE_INVARIANTS.md",
    ".ai/context-manifest.yaml"
  ],
  "output_refs": [
    "docs/implementation-reports/ISSUE-227.md"
  ],
  "status": "completed",
  "commands": [
    {"name": "focused-tests", "status": "PASS"},
    {"name": "full-pytest", "status": "PASS"},
    {"name": "quality", "status": "PASS"},
    {"name": "diff-check", "status": "PASS"},
    {"name": "validate-change", "status": "FAIL"}
  ],
  "validation_results": [
    {"name": "schema-validation", "status": "PASS"},
    {"name": "serialization-round-trip", "status": "PASS"},
    {"name": "latest-history-consumers", "status": "PASS"},
    {"name": "daily-story-ai-consumers", "status": "PASS"},
    {"name": "public-export-privacy", "status": "PASS"},
    {"name": "edge-canary", "status": "NOT_RUN"}
  ],
  "human_edits": [],
  "findings": [],
  "errors": [
    {
      "kind": "tooling",
      "message": "validate_change maturity gate does not load the present run artifact and reports it missing"
    }
  ],
  "usage": {
    "file_count": 19,
    "input_characters": 100000,
    "tool_output_bytes": 300000,
    "elapsed_seconds": 1920
  }
}
