{
  "schema": "agent_run_v1",
  "run_id": "20260825-issue-229-coder",
  "issue_ref": "ISSUE-229",
  "pr_ref": null,
  "role": "coder",
  "agent_id": "codex-local",
  "prompt_version": "human-approved-implementation-plan-v1",
  "started_at_utc": "2026-08-25T17:02:23Z",
  "finished_at_utc": "2026-08-25T17:23:30Z",
  "input_refs": [
    "AGENTS.md",
    ".ai/CORE_INVARIANTS.md",
    ".ai/context-manifest.yaml",
    "ISSUE-229-human-approved-plan"
  ],
  "output_refs": [
    "docs/implementation-reports/ISSUE-229.md"
  ],
  "status": "completed",
  "commands": [
    {"name": "focused-tests", "status": "PASS"},
    {"name": "full-pytest", "status": "PASS"},
    {"name": "quality", "status": "PASS"},
    {"name": "compose-config-observability", "status": "PASS"},
    {"name": "diff-check", "status": "PASS"},
    {"name": "validate-change", "status": "FAIL"},
    {"name": "isolated-runtime-rehearsal", "status": "NOT_RUN"}
  ],
  "validation_results": [
    {"name": "schema-validation", "status": "PASS"},
    {"name": "serialization-round-trip", "status": "PASS"},
    {"name": "fixture-replay", "status": "PASS"},
    {"name": "named-consumers", "status": "PASS"},
    {"name": "public-export-privacy", "status": "PASS"},
    {"name": "edge-canary", "status": "NOT_RUN"},
    {"name": "isolated-rehearsal-rollback-post-deploy-health", "status": "NOT_RUN"}
  ],
  "human_edits": [],
  "findings": [],
  "errors": [],
  "usage": {
    "file_count": 14,
    "input_characters": 140000,
    "tool_output_bytes": 260000,
    "elapsed_seconds": 1267
  }
}
