{
  "schema": "agent_run_v1",
  "run_id": "20260911-issue-206-coder",
  "issue_ref": "#206",
  "pr_ref": null,
  "role": "coder",
  "agent_id": "codex-gpt-5",
  "prompt_version": "gpt-5.6-luna",
  "started_at_utc": "2026-09-11T00:00:00Z",
  "finished_at_utc": "2026-09-11T00:00:00Z",
  "input_refs": [".ai/CORE_INVARIANTS.md", ".ai/planning/implementation-brief-206.md"],
  "output_refs": ["docs/implementation-reports/ISSUE-206.md", "docs/schemas/pomidorctl-error-v1.schema.json"],
  "status": "completed",
  "commands": [
    {"command": "python -m pytest -q tests/test_pomidorctl.py tests/test_operator_summary.py tests/test_contract_fixtures.py -p no:cacheprovider", "status": "PASS"},
    {"command": "python -m pytest -q -p no:cacheprovider", "status": "PASS"},
    {"command": "ruff check app/pomidorctl tests/test_pomidorctl.py", "status": "PASS"},
    {"command": "ruff format --check app/pomidorctl tests/test_pomidorctl.py", "status": "PASS"},
    {"command": "python -m mypy app/pomidorctl", "status": "PASS"},
    {"command": "git diff --check", "status": "PASS"},
    {"command": "bandit -c pyproject.toml -r app tools", "status": "PASS"},
    {"command": "pip-audit --skip-editable --cache-dir .pip-audit-cache", "status": "FAIL"},
    {"command": "python -m pip wheel --no-deps --no-build-isolation . --wheel-dir .wheel-check", "status": "PASS"},
    {"command": "python -m pytest -q tests/test_pomidorctl.py -p no:cacheprovider", "status": "PASS"}
  ],
  "validation_results": [
    {"check": "focused_tests", "status": "PASS", "evidence": "boundary and contract tests passed"},
    {"check": "full_pytest", "status": "PASS", "evidence": "650 passed, 12 skipped"},
    {"check": "quality", "status": "PASS", "evidence": "focused ruff and mypy passed; nox setup unavailable"},
    {"check": "diff_check", "status": "PASS", "evidence": "no whitespace errors"},
    {"check": "security", "status": "PASS", "evidence": "bandit reported no issues"},
    {"check": "deps_audit", "status": "FAIL", "evidence": "baseline reports 56 known vulnerabilities"},
    {"check": "package_contract", "status": "PASS", "evidence": "wheel contains CLI module and entry point"},
    {"check": "fastapi_cli_replay", "status": "PASS", "evidence": "FastAPI boundary response validated by OperatorClient"},
    {"check": "manual_edge_canary", "status": "NOT_RUN", "evidence": "operator-owned physical evidence"}
  ],
  "human_edits": [],
  "findings": [],
  "errors": [],
  "usage": {"file_count": 18, "input_characters": 0, "tool_output_bytes": 0, "elapsed_seconds": 0}
}
