{"agent_id":"reviewer-local","commands":[{"name":"privacy-review","status":"NOT_RUN"}],"errors":[],"findings":[{"category":"evidence","outcome":"open","role":"reviewer"}],"finished_at_utc":"2026-08-10T10:05:00Z","human_edits":[],"input_refs":[".ai/agent-runs/2026-08-pilot-coder.json"],"issue_ref":"TOMATO-AI-14","output_refs":["docs/implementation-reports/TOMATO-AI-13-14.md"],"pr_ref":null,"prompt_version":"brief-v1","role":"reviewer","run_id":"2026-08-pilot-reviewer","schema":"agent_run_v1","started_at_utc":"2026-08-10T10:00:00Z","status":"completed","usage":{"elapsed_seconds":300,"file_count":6,"input_characters":6000,"tool_output_bytes":2000},"validation_results":[{"name":"privacy-review","status":"NOT_RUN"}]}
