{
  "schema": "agent_run_v1",
  "run_id": "20260910-issue-344-coder",
  "issue_ref": "#344",
  "pr_ref": null,
  "role": "coder",
  "agent_id": "codex-local",
  "prompt_version": "github-issue-344",
  "started_at_utc": "2026-09-10T09:07:57Z",
  "finished_at_utc": "2026-09-10T09:25:59Z",
  "input_refs": [
    ".ai/CORE_INVARIANTS.md",
    "AGENTS.md"
  ],
  "output_refs": [
    "app/state_estimator/replay.py",
    "tools/demo_state_estimator.py",
    "tests/state_estimator/test_demo_runner.py",
    "docs/STATE_ESTIMATOR_DEMO.md",
    "docs/implementation-reports/ISSUE-344.md"
  ],
  "status": "completed",
  "commands": [
    {"name": "context-routing", "status": "PASS"},
    {"name": "focused-tests", "status": "PASS"},
    {"name": "full-pytest", "status": "FAIL"},
    {"name": "quality", "status": "PASS"},
    {"name": "diff-check", "status": "PASS"},
    {"name": "compose-config", "status": "NOT_RUN"},
    {"name": "canonical-validation", "status": "FAIL"},
    {"name": "audit-validation", "status": "PASS"}
  ],
  "validation_results": [
    {"name": "focused-tests", "status": "PASS"},
    {"name": "full-pytest", "status": "FAIL"},
    {"name": "quality", "status": "PASS"},
    {"name": "diff-check", "status": "PASS"},
    {"name": "compose-config", "status": "NOT_RUN"},
    {"name": "independent-review", "status": "NOT_RUN"},
    {"name": "production-staging-hardware-export", "status": "NOT_RUN"}
  ],
  "human_edits": [],
  "findings": [
    {
      "category": "semantics",
      "outcome": "Current configured-probe Guardrail semantics can block while aggregate state quality remains GOOD",
      "role": "coder"
    }
  ],
  "errors": [
    {
      "category": "runtime",
      "outcome": "Docker executable unavailable; one full-suite test and Compose verification could not run"
    },
    {
      "category": "tooling",
      "outcome": "Canonical validation injected task Compose identity into staging tests and omitted nox from PATH"
    }
  ],
  "usage": {
    "file_count": 8,
    "input_characters": 0,
    "tool_output_bytes": 0,
    "elapsed_seconds": 1082
  }
}
