{
  "schema": "agent_run_v1",
  "run_id": "20260831-component-unknown-precedence-fix-coder",
  "issue_ref": null,
  "pr_ref": null,
  "role": "coder",
  "agent_id": "codex-local",
  "prompt_version": "human-approved-review-fix-v1",
  "started_at_utc": "2026-08-31T04:31:00Z",
  "finished_at_utc": "2026-08-31T04:42:13Z",
  "input_refs": [
    "AGENTS.md",
    ".ai/CORE_INVARIANTS.md",
    ".ai/context-manifest.yaml",
    "docs/CONTRACTS.md",
    "app/edge_reliability.py",
    "docker/grafana/provisioning/dashboards/json/senior-pomidor-edge-reliability.json"
  ],
  "output_refs": [
    "app/edge_reliability.py",
    "docker/grafana/provisioning/dashboards/json/senior-pomidor-edge-reliability.json",
    "tests/test_edge_reliability.py",
    "tests/test_grafana_provisioning.py",
    ".ai/agent-runs/20260831-component-unknown-precedence-fix-coder.json"
  ],
  "status": "completed",
  "commands": [
    {"name": "focused-tests", "status": "PASS"},
    {"name": "full-pytest", "status": "PASS"},
    {"name": "quality", "status": "PASS"},
    {"name": "compose-config", "status": "PASS"},
    {"name": "diff-check", "status": "PASS"}
  ],
  "validation_results": [
    {"name": "api-mixed-state-precedence", "status": "PASS"},
    {"name": "dashboard-mixed-state-precedence", "status": "PASS"},
    {"name": "isolated-rehearsal-rollback-post-deploy-health", "status": "NOT_RUN"}
  ],
  "human_edits": [],
  "findings": [
    {"category": "precedence", "outcome": "confirmed", "role": "reviewer"}
  ],
  "errors": [],
  "usage": {
    "file_count": 5,
    "input_characters": 106848,
    "tool_output_bytes": 150000,
    "elapsed_seconds": 673
  }
}
