{
  "schema": "agent_run_v1",
  "run_id": "20260909-issue-334-coder",
  "issue_ref": "#334",
  "pr_ref": null,
  "role": "coder",
  "agent_id": "codex-local",
  "prompt_version": "implementation-brief-v1",
  "started_at_utc": "2026-09-09T10:00:00Z",
  "finished_at_utc": "2026-09-09T10:30:00Z",
  "input_refs": [".ai/CORE_INVARIANTS.md", ".ai/planning/implementation-brief-334.md", "docs/TOMATO_BRAIN_MAP_R1_SPEC.md"],
  "output_refs": ["app/map/capability.py", "app/map/evaluator.py", "tests/test_map_evaluator.py", "docs/implementation-reports/ISSUE-334.md"],
  "status": "completed",
  "commands": [{"name": "context-routing", "status": "PASS"}, {"name": "focused-tests", "status": "PASS"}, {"name": "full-pytest", "status": "PASS"}, {"name": "quality", "status": "FAIL"}, {"name": "diff-check", "status": "PASS"}, {"name": "canonical-validation", "status": "FAIL"}, {"name": "audit-validation", "status": "PASS"}],
  "validation_results": [{"name": "focused-tests", "status": "PASS"}, {"name": "full-pytest", "status": "PASS"}, {"name": "quality", "status": "FAIL"}, {"name": "diff-check", "status": "PASS"}, {"name": "canonical-validation", "status": "FAIL"}, {"name": "independent-review", "status": "NOT_RUN"}, {"name": "production-staging-hardware-export", "status": "NOT_RUN"}],
  "human_edits": [],
  "findings": [{"category": "scope", "outcome": "Evaluator remains inactive; API and UI are not implemented", "role": "coder"}],
  "errors": [{"category": "tooling", "outcome": "validate_change reports unknown task key tomato-334-map-capability-evaluator; implementation checks otherwise completed"}],
  "usage": {"file_count": 8, "input_characters": 0, "tool_output_bytes": 0, "elapsed_seconds": 1800}
}
