{
  "schema": "agent_run_v1",
  "run_id": "20260826-issue-247-coder",
  "issue_ref": "#260",
  "pr_ref": "#268",
  "role": "coder",
  "agent_id": "codex-local",
  "prompt_version": "human-approved-release-qualification-plan-v1",
  "started_at_utc": "2026-08-26T09:32:31Z",
  "finished_at_utc": "2026-08-26T15:45:00Z",
  "input_refs": [
    "AGENTS.md",
    ".ai/CORE_INVARIANTS.md",
    ".ai/context-manifest.yaml",
    ".ai/implementation-briefs/ISSUE-247-release-qualification-225.md"
  ],
  "output_refs": [
    "docs/implementation-reports/ISSUE-247-release-qualification-225.md",
    "docs/schemas/system-invariants-v1.schema.json",
    "docs/schemas/edge-core-compatibility-report-v1.schema.json",
    "docs/schemas/release-validation-v1.schema.json",
    "ISSUE-260"
  ],
  "status": "completed",
  "commands": [
    {"name": "focused-tests", "status": "PASS"},
    {"name": "full-pytest", "status": "PASS"},
    {"name": "quality", "status": "PASS"},
    {"name": "security", "status": "PASS"},
    {"name": "dependency-audit", "status": "PASS"},
    {"name": "compose-config", "status": "PASS"},
    {"name": "docker-e2e-runtime", "status": "NOT_RUN"},
    {"name": "diff-check", "status": "PASS"}
  ],
  "validation_results": [
    {"name": "schema-validation", "status": "PASS"},
    {"name": "serialization-round-trip", "status": "PASS"},
    {"name": "fixture-replay", "status": "PASS"},
    {"name": "named-consumers", "status": "PASS"},
    {"name": "staging-isolation-config", "status": "PASS"},
    {"name": "real-edge-core-staging", "status": "NOT_RUN"},
    {"name": "edge-canary", "status": "NOT_RUN"},
    {"name": "rollback-post-deploy-health", "status": "NOT_RUN"}
  ],
  "human_edits": [],
  "findings": [
    {"name": "incomplete-pass-counts", "status": "RESOLVED", "category": "correctness"},
    {"name": "unenforced-gate-duration", "status": "RESOLVED", "category": "correctness"},
    {"name": "mutable-image-reference", "status": "RESOLVED", "category": "security"},
    {"name": "unverified-compose-cleanup", "status": "RESOLVED", "category": "safety"},
    {"name": "production-mode-env-dependency", "status": "RESOLVED", "category": "safety"},
    {"name": "sql-only-alert-evidence", "status": "RESOLVED", "category": "tests"},
    {"name": "release-qualification-remains-open", "status": "NOT_RUN", "category": "operations"}
  ],
  "errors": [
    {"name": "docker-engine-unavailable", "status": "bounded"},
    {"name": "actionlint-unavailable", "status": "bounded"}
  ],
  "usage": {
    "file_count": 40,
    "input_characters": 148450,
    "tool_output_bytes": 500000,
    "elapsed_seconds": 22349
  }
}
