{"agent_id":"codex-local","commands":[{"name":"focused-tests","status":"PASS"}],"errors":[],"findings":[],"finished_at_utc":"2026-08-10T09:10:00Z","human_edits":[],"input_refs":[".ai/implementation-briefs/TOMATO-AI-13-14.md"],"issue_ref":"TOMATO-AI-13","output_refs":["docs/implementation-reports/TOMATO-AI-13-14.md"],"pr_ref":null,"prompt_version":"brief-v1","role":"coder","run_id":"2026-08-pilot-coder","schema":"agent_run_v1","started_at_utc":"2026-08-10T09:00:00Z","status":"completed","usage":{"elapsed_seconds":600,"file_count":12,"input_characters":12000,"tool_output_bytes":4000},"validation_results":[{"name":"focused-tests","status":"PASS"}]}
