{
  "schema": "agent_run_v1",
  "run_id": "20260831-service-manager-discriminator-fix-coder",
  "issue_ref": null,
  "pr_ref": null,
  "role": "coder",
  "agent_id": "codex-local",
  "prompt_version": "human-approved-review-fix-v1",
  "started_at_utc": "2026-08-31T04:43:00Z",
  "finished_at_utc": "2026-08-31T05:04:42Z",
  "input_refs": [
    "AGENTS.md",
    ".ai/CORE_INVARIANTS.md",
    ".ai/context-manifest.yaml",
    "docs/CONTRACTS.md",
    "docs/schemas/telemetry-v2.schema.json",
    "app/telemetry.py",
    "app/edge_reliability.py"
  ],
  "output_refs": [
    "app/telemetry.py",
    "app/edge_reliability.py",
    "docs/CONTRACTS.md",
    "docs/schemas/telemetry-v2.schema.json",
    "tests/fixtures/contracts/telemetry_v2.json",
    "tests/test_edge_reliability.py",
    "tests/test_api.py",
    "tests/test_contract_fixtures.py",
    "tests/test_grafana_provisioning.py",
    "tests/test_operator_edge_reliability.py",
    "docker/grafana/provisioning/dashboards/json/senior-pomidor-edge-reliability.json",
    ".ai/agent-runs/20260831-service-manager-discriminator-fix-coder.json"
  ],
  "status": "completed",
  "commands": [
    {"name": "focused-tests", "status": "PASS"},
    {"name": "full-pytest", "status": "PASS"},
    {"name": "quality", "status": "PASS"},
    {"name": "compose-config", "status": "PASS"},
    {"name": "diff-check", "status": "PASS"}
  ],
  "validation_results": [
    {"name": "schema-validation", "status": "PASS"},
    {"name": "serialization-round-trip", "status": "PASS"},
    {"name": "fixture-replay", "status": "PASS"},
    {"name": "named-consumers", "status": "PASS"},
    {"name": "edge-canary", "status": "NOT_RUN"},
    {"name": "isolated-rehearsal-rollback-post-deploy-health", "status": "NOT_RUN"}
  ],
  "human_edits": [],
  "findings": [
    {"category": "contract-discriminator", "outcome": "confirmed", "role": "reviewer"}
  ],
  "errors": [],
  "usage": {
    "file_count": 12,
    "input_characters": 137998,
    "tool_output_bytes": 210000,
    "elapsed_seconds": 1302
  }
}
