{
  "schema": "agent_run_v1",
  "run_id": "20260830-aggregate-contract-review-fix-coder",
  "issue_ref": null,
  "pr_ref": null,
  "role": "coder",
  "agent_id": "codex-local",
  "prompt_version": "human-approved-review-fix-v1",
  "started_at_utc": "2026-08-30T19:35:00Z",
  "finished_at_utc": "2026-08-30T20:03:04Z",
  "input_refs": [
    "AGENTS.md",
    ".ai/CORE_INVARIANTS.md",
    ".ai/context-manifest.yaml",
    "app/validation.py",
    "docs/schemas/telemetry-v2.schema.json"
  ],
  "output_refs": [
    "docs/schemas/telemetry-v2.schema.json",
    "tests/test_api.py",
    "tests/test_contract_fixtures.py",
    ".ai/agent-runs/20260830-aggregate-contract-review-fix-coder.json"
  ],
  "status": "completed",
  "commands": [
    {"name": "focused-tests", "status": "PASS"},
    {"name": "full-pytest", "status": "PASS"},
    {"name": "quality", "status": "PASS"},
    {"name": "diff-check", "status": "PASS"}
  ],
  "validation_results": [
    {"name": "schema-validation", "status": "PASS"},
    {"name": "serialization-round-trip", "status": "PASS"},
    {"name": "fixture-replay", "status": "PASS"},
    {"name": "named-consumers", "status": "PASS"},
    {"name": "edge-canary", "status": "NOT_RUN"}
  ],
  "human_edits": [],
  "findings": [
    {"category": "compatibility", "outcome": "confirmed", "role": "reviewer"},
    {"category": "contract", "outcome": "confirmed", "role": "reviewer"}
  ],
  "errors": [],
  "usage": {
    "file_count": 4,
    "input_characters": 95227,
    "tool_output_bytes": 180000,
    "elapsed_seconds": 1684
  }
}
