{
  "schema": "agent_run_v1",
  "run_id": "20260911-issue-205-coder",
  "issue_ref": "#205",
  "pr_ref": null,
  "role": "coder",
  "agent_id": "codex-gpt-5",
  "prompt_version": "gpt-5.6-luna",
  "started_at_utc": "2026-09-11T00:00:00Z",
  "finished_at_utc": "2026-09-11T00:00:00Z",
  "input_refs": [".ai/CORE_INVARIANTS.md", ".ai/planning/implementation-brief-205.md", ".ai/test-matrix.yaml"],
  "output_refs": ["docs/implementation-reports/ISSUE-205.md", "docs/schemas/operator-v1.schema.json"],
  "status": "completed",
  "commands": [
    {"command": "python -m pytest -q tests/test_operator_edge_reliability.py tests/test_api.py -p no:cacheprovider", "status": "PASS"},
    {"command": "ruff check app/operator_summary.py app/api.py", "status": "PASS"},
    {"command": "python -m mypy app/operator_summary.py app/api.py", "status": "PASS"},
    {"command": "git diff --check", "status": "PASS"},
    {"command": "python -m pytest -q -p no:cacheprovider", "status": "PASS"},
    {"command": "nox -s lint format_check types", "status": "PASS"}
  ],
  "validation_results": [
    {"check": "focused_tests", "status": "PASS", "evidence": "78 API and operator tests passed"},
    {"check": "full_pytest", "status": "PASS", "evidence": "609 passed, 12 skipped"},
    {"check": "quality", "status": "PASS", "evidence": "nox lint, format_check, and types passed"},
    {"check": "diff_check", "status": "PASS", "evidence": "no whitespace errors"},
    {"check": "schema_validation", "status": "PASS", "evidence": "Draft 2020-12 decisions response validation passed"},
    {"check": "validate_change", "status": "FAIL", "evidence": "unknown agent task tomato-205-operator-read-model"},
    {"check": "manual_edge_canary", "status": "NOT_RUN", "evidence": "operator-owned physical evidence"}
  ],
  "human_edits": [],
  "findings": [],
  "errors": [],
  "usage": {"file_count": 12, "input_characters": 94978, "tool_output_bytes": 0, "elapsed_seconds": 0}
}
