{
  "schema": "agent_run_v1",
  "run_id": "20260831-issue-283-coder",
  "issue_ref": "#283",
  "pr_ref": null,
  "role": "coder",
  "agent_id": "codex-local",
  "prompt_version": "human-approved-hotfix-v1",
  "started_at_utc": "2026-08-31T14:11:00Z",
  "finished_at_utc": "2026-08-31T14:28:33Z",
  "input_refs": [
    "AGENTS.md",
    ".ai/CORE_INVARIANTS.md",
    ".ai/context-manifest.yaml",
    ".ai/test-matrix.yaml",
    "docs/CONTRACTS.md",
    "docs/PRODUCTION_RELEASE_INSTALLATION_RUNBOOK.md"
  ],
  "output_refs": [
    "app/edge_reliability.py",
    "app/telemetry.py",
    "docker/grafana/provisioning/alerting/edge-reliability-alerts.yml",
    "docker/grafana/provisioning/dashboards/json/senior-pomidor-edge-reliability.json",
    "docs/CONTRACTS.md",
    "docs/PRODUCTION_RELEASE_INSTALLATION_RUNBOOK.md",
    "docs/implementation-reports/ISSUE-260.md",
    "docs/implementation-reports/ISSUE-283.md",
    "docs/schemas/telemetry-v2.schema.json",
    "tests/fixtures/contracts/telemetry_v2.json",
    "tests/test_api.py",
    "tests/test_contract_fixtures.py",
    "tests/test_docker_e2e.py",
    "tests/test_edge_reliability.py",
    "tests/test_grafana_provisioning.py",
    "tests/test_mqtt_worker.py",
    "tests/test_operator_edge_reliability.py",
    "tests/test_release_assets.py",
    ".ai/agent-runs/20260831-issue-283-coder.json"
  ],
  "status": "completed",
  "commands": [
    {"name": "focused-tests", "status": "PASS", "evidence": "163 passed and 1 skipped"},
    {"name": "full-pytest", "status": "PASS", "evidence": "518 passed and 12 skipped"},
    {"name": "quality", "status": "PASS", "evidence": "lint format and types passed"},
    {"name": "compose-config", "status": "PASS", "evidence": "11 passed"},
    {"name": "diff-check", "status": "PASS"}
  ],
  "validation_results": [
    {"name": "schema-validation", "status": "PASS"},
    {"name": "serialization-round-trip", "status": "PASS"},
    {"name": "fixture-replay", "status": "PASS"},
    {"name": "named-consumers", "status": "PASS"},
    {"name": "agent-audit", "status": "PASS"},
    {"name": "docker-e2e", "status": "NOT_RUN", "reason": "Docker Desktop Linux engine unavailable locally"},
    {"name": "edge-canary", "status": "NOT_RUN"},
    {"name": "isolated-rehearsal-rollback-post-deploy-health", "status": "NOT_RUN"}
  ],
  "human_edits": [],
  "findings": [
    {"category": "edge-core-compatibility", "outcome": "hotfix-ready-for-review", "role": "coder"}
  ],
  "errors": [],
  "usage": {
    "file_count": 27,
    "input_characters": 194797,
    "tool_output_bytes": 320000,
    "elapsed_seconds": 1053
  }
}
