{
  "schema": "agent_run_v1",
  "run_id": "20260824-issue-226-coder",
  "issue_ref": "ISSUE-226",
  "pr_ref": null,
  "role": "coder",
  "agent_id": "codex-local",
  "prompt_version": "human-approved-implementation-brief-v1",
  "started_at_utc": "2026-08-24T13:39:53Z",
  "finished_at_utc": "2026-08-24T14:04:03Z",
  "input_refs": [
    "AGENTS.md",
    ".ai/CORE_INVARIANTS.md",
    ".ai/context-manifest.yaml"
  ],
  "output_refs": [
    "docs/implementation-reports/ISSUE-226.md"
  ],
  "status": "completed",
  "commands": [
    {"name": "focused-tests", "status": "PASS"},
    {"name": "full-pytest", "status": "PASS"},
    {"name": "quality", "status": "PASS"},
    {"name": "diff-check", "status": "PASS"}
  ],
  "validation_results": [
    {"name": "schema-validation", "status": "PASS"},
    {"name": "serialization-round-trip", "status": "PASS"},
    {"name": "http-mqtt-fixture-replay", "status": "PASS"},
    {"name": "public-consumer-privacy", "status": "PASS"},
    {"name": "edge-canary", "status": "NOT_RUN"}
  ],
  "human_edits": [],
  "findings": [],
  "errors": [],
  "usage": {
    "file_count": 12,
    "input_characters": 90000,
    "tool_output_bytes": 250000,
    "elapsed_seconds": 1450
  }
}
